[{"id":"buddhism","type":"tradition","label":"Buddhism","kind":"family","parent":null,"children":["theravada","mahayana","vajrayana","buddhist-studies","triratna"],"blurb":"The path of the Buddha: seeing suffering, its cause in craving, and its ending, through virtue, meditation and wisdom.","founders":["the-buddha"],"ids":{"wikidata":"Q748"},"meta":{"license":"CC-BY-4.0"}},{"id":"theravada","type":"tradition","label":"Theravāda","kind":"school","parent":"buddhism","children":["early-suttas","thai-forest","insight","burmese","sri-lankan"],"blurb":"The oldest surviving Buddhist school, rooted in the Pāli discourses and the monastic code; strong today in Sri Lanka and Southeast Asia.","founders":[],"ids":{"wikidata":"Q132265"},"meta":{"license":"CC-BY-4.0"}},{"id":"early-suttas","type":"tradition","label":"Early suttas","kind":"lineage","parent":"theravada","children":[],"blurb":"Practice read straight from the early discourses, outside the commentarial mainstream; Hillside Hermitage belongs here, drawing on Ñāṇavīra Thera.","founders":[],"ids":{"wikidata":"Q3073049"},"meta":{"license":"CC-BY-4.0"}},{"id":"thai-forest","type":"tradition","label":"Thai Forest","kind":"lineage","parent":"theravada","children":["chah-line","mun-boowa-line"],"blurb":"The forest monastic lineage of Ajahn Mun and Ajahn Chah.","founders":["ajahn-chah"],"ids":{"wikidata":"Q1473142"},"meta":{"license":"CC-BY-4.0"}},{"id":"insight","type":"tradition","label":"Insight meditation","kind":"lineage","parent":"theravada","children":[],"blurb":"The modern vipassanā movement and its Western retreat centres.","founders":["mahasi-sayadaw","joseph-goldstein"],"ids":{"wikidata":"Q17015142"},"meta":{"license":"CC-BY-4.0"}},{"id":"mahayana","type":"tradition","label":"Mahāyāna","kind":"school","parent":"buddhism","children":["zen","chan","tiantai","huayan","pure-land","nipponzan-myohoji"],"blurb":"The \"great vehicle\": the bodhisattva ideal of awakening for the sake of all beings, and the teaching of emptiness.","founders":[],"ids":{"wikidata":"Q48362"},"meta":{"license":"CC-BY-4.0"}},{"id":"zen","type":"tradition","label":"Zen","kind":"lineage","parent":"mahayana","children":["plum-village","soto-zen","rinzai-zen","sanbo-zen","ordinary-mind"],"blurb":"Chan and Zen: awakening through sitting, direct pointing and the teacher–student encounter, more than through scripture.","founders":["dogen","bodhidharma"],"ids":{"wikidata":"Q7953"},"meta":{"license":"CC-BY-4.0"}},{"id":"vajrayana","type":"tradition","label":"Vajrayāna","kind":"school","parent":"buddhism","children":["tibetan","east-asian-esoteric"],"blurb":"Tantric Buddhism: deity practice, mantra and the teacher's transmission as a swift path to awakening.","founders":[],"ids":{"wikidata":"Q172175"},"meta":{"license":"CC-BY-4.0"}},{"id":"tibetan","type":"tradition","label":"Tibetan Buddhism","kind":"lineage","parent":"vajrayana","children":["gelug","kagyu","nyingma","sakya","jonang","bon","rime","new-kadampa"],"blurb":"The Buddhism of the Himalaya, joining monastic study and debate with Vajrayāna practice and guidance for the dying.","founders":[],"ids":{"wikidata":"Q483889"},"meta":{"license":"CC-BY-4.0"}},{"id":"hindu","type":"tradition","label":"Hindu traditions","kind":"family","parent":null,"children":["vedanta","kriya-yoga","anandamayi-sangha","siddha-yoga","shaivism","shaktism","tantra-studies","yoga-traditions","vaishnava","hindu-studies","swaminarayan","brahma-kumaris"],"blurb":"The many paths that grew from the Vedas and Upanishads: knowledge, devotion, yoga and action.","founders":[],"ids":{"wikidata":"Q9089"},"meta":{"license":"CC-BY-4.0"}},{"id":"vedanta","type":"tradition","label":"Vedānta","kind":"school","parent":"hindu","children":["advaita","ramakrishna-order","divine-life-society","transcendental-meditation"],"blurb":"Philosophy built on the Upanishads, the Bhagavad Gītā and the Brahma Sūtras, asking how the self relates to Brahman.","founders":[],"ids":{"wikidata":"Q2512051"},"meta":{"license":"CC-BY-4.0"}},{"id":"advaita","type":"tradition","label":"Advaita Vedānta","kind":"lineage","parent":"vedanta","children":["inchegeri","direct-path","arsha-vidya","chinmaya-mission"],"blurb":"Non-dual Vedānta: the Self (ātman) is Brahman, and the world of separate selves is an appearance.","founders":["adi-shankara"],"ids":{"wikidata":"Q2348383"},"meta":{"license":"CC-BY-4.0"}},{"id":"inchegeri","type":"tradition","label":"Inchegeri Sampradaya","kind":"lineage","parent":"advaita","children":[],"blurb":"The Navnath line of Siddharameshwar and Nisargadatta Maharaj.","founders":["bhausaheb-maharaj"],"ids":{"wikidata":"Q6014394"},"meta":{"license":"CC-BY-4.0"}},{"id":"ramakrishna-order","type":"tradition","label":"Ramakrishna Order","kind":"lineage","parent":"vedanta","children":[],"blurb":"The monastic order founded on Ramakrishna's teaching and Vivekananda's mission: Vedānta lived as service.","founders":["swami-vivekananda","ramakrishna"],"ids":{"wikidata":"Q17010088"},"meta":{"license":"CC-BY-4.0"}},{"id":"kashmir-shaivism","type":"tradition","label":"Kashmir Shaivism","kind":"lineage","parent":"shaivism","children":["trika","pratyabhijna","spanda","krama"],"blurb":"A non-dual Tantric philosophy in which the world is the free, conscious play of Shiva, recognised as one's own self.","founders":["shiva-sutras","vijnana-bhairava","vasugupta"],"ids":{"wikidata":"Q1734884"},"meta":{"license":"CC-BY-4.0"}},{"id":"kriya-yoga","type":"tradition","label":"Kriya Yoga","kind":"lineage","parent":"hindu","children":[],"blurb":"The line of Mahavatar Babaji, Lahiri Mahasaya and Paramahansa Yogananda.","founders":[],"ids":{"wikidata":"Q180678"},"meta":{"license":"CC-BY-4.0"}},{"id":"christian","type":"tradition","label":"Christian traditions","kind":"family","parent":null,"children":["christian-mysticism","gnosticism","christian-meditation-wccm","franciscan","wisdom-christianity","hesychasm","quaker","benedictine","ignatian","celtic-christianity","franciscan-contemplative"],"blurb":"The traditions that follow Jesus of Nazareth, from the Gospels and the early Church to the mystics.","founders":["jesus"],"ids":{"wikidata":"Q5043"},"meta":{"license":"CC-BY-4.0"}},{"id":"christian-mysticism","type":"tradition","label":"Christian mysticism","kind":"school","parent":"christian","children":["carmelite"],"blurb":"Christians who sought direct union with God: detachment, contemplative prayer and the birth of God in the soul.","founders":[],"ids":{"wikidata":"Q655970"},"meta":{"license":"CC-BY-4.0"}},{"id":"gnosticism","type":"tradition","label":"Gnosticism","kind":"school","parent":"christian","children":[],"blurb":"Early Christian and related movements of saving knowledge (gnosis); known mostly through texts such as the Nag Hammadi library.","founders":["nag-hammadi"],"ids":{"wikidata":"Q48420"},"meta":{"license":"CC-BY-4.0"}},{"id":"platonic","type":"tradition","label":"Platonic tradition","kind":"family","parent":null,"children":["neoplatonism","presocratic-mysticism"],"blurb":"Philosophy as the care of the soul, turning from the world of change toward the eternal Forms and the Good.","founders":["plato"],"ids":{"wikidata":"Q193589"},"meta":{"license":"CC-BY-4.0"}},{"id":"neoplatonism","type":"tradition","label":"Neoplatonism","kind":"school","parent":"platonic","children":["renaissance-platonism","theurgy"],"blurb":"Late antique Platonism: everything flows from the One, and the soul can return to it through contemplation.","founders":["plotinus"],"ids":{"wikidata":"Q162145"},"meta":{"license":"CC-BY-4.0"}},{"id":"renaissance-platonism","type":"tradition","label":"Renaissance Platonism","kind":"lineage","parent":"neoplatonism","children":[],"blurb":"The revival of Plato and Plotinus in fifteenth-century Florence, joining Platonic philosophy with Christian faith.","founders":["marsilio-ficino"],"ids":{"wikidata":"Q7202435"},"meta":{"license":"CC-BY-4.0"}},{"id":"esoteric","type":"tradition","label":"Western esotericism","kind":"family","parent":null,"children":["theosophy","anthroposophy","fourth-way","hermeticism","alchemy","western-magic","christian-theosophy","rosicrucianism","western-esotericism-scholarship","imaginal","swedenborgian","spiritualism","learned-magic"],"blurb":"Western paths of hidden knowledge: Hermeticism, Theosophy, Anthroposophy and the Fourth Way.","founders":[],"ids":{"wikidata":"Q7988482"},"meta":{"license":"CC-BY-4.0"}},{"id":"theosophy","type":"tradition","label":"Theosophy","kind":"school","parent":"esoteric","children":[],"blurb":"The movement of Blavatsky and the Theosophical Society, joining Eastern ideas of karma and rebirth with Western occultism.","founders":["helena-blavatsky"],"ids":{"wikidata":"Q178671"},"meta":{"license":"CC-BY-4.0"}},{"id":"anthroposophy","type":"tradition","label":"Anthroposophy","kind":"school","parent":"esoteric","children":[],"blurb":"Rudolf Steiner's spiritual science: a path of clear thinking toward knowledge of spiritual worlds, karma and repeated earth lives.","founders":["rudolf-steiner"],"ids":{"wikidata":"Q184719"},"meta":{"license":"CC-BY-4.0"}},{"id":"fourth-way","type":"tradition","label":"The Fourth Way","kind":"school","parent":"esoteric","children":[],"blurb":"Gurdjieff's path of self-remembering and conscious effort in the middle of ordinary life.","founders":["george-gurdjieff"],"ids":{"wikidata":"Q470418"},"meta":{"license":"CC-BY-4.0"}},{"id":"independent","type":"tradition","label":"Independent","kind":"family","parent":null,"children":["modern-nondual","krishnamurti"],"blurb":"Teachers who stand outside any tradition.","founders":[],"meta":{"license":"CC-BY-4.0"}},{"id":"direct-path","type":"tradition","label":"Direct path","kind":"lineage","parent":"advaita","children":[],"blurb":"The non-dual enquiry into experience taught by Atmananda Krishna Menon and carried on by Jean Klein, Francis Lucille and Rupert Spira.","founders":["atmananda-krishna-menon"],"meta":{"license":"CC-BY-4.0"}},{"id":"arsha-vidya","type":"tradition","label":"Ar